### ISSUE TITLE
pox crashes when connection closes too soon

### ISSUE THREAD

**Issue by abbbe** [noxrepo/pox#18]
It appears that POX fails to handle a condition when client closes the connection spontaneously. I experience the following errors, which go away when I introduce a delay on the client side.

abb@mitmer-testbed-mitmer:~/pox$ python pox.py --no-cli forwarding.l2_learning nm.test
POX 0.0.0 / Copyright 2011 James McCauley
test_9999_crash_on_rapid_close (pox.nm.test.TestController)
apparently this test upsets pox by closing connection too fast ... Exception in thread Thread-1:
Traceback (most recent call last):
  File "/usr/lib/python2.7/threading.py", line 551, in __bootstrap_inner
    self.run()
  File "/usr/lib/python2.7/threading.py", line 504, in run
    self.__arget(_self.__args, *_self.__kwargs)
  File "/home/abb/pox/pox/lib/recoco/recoco.py", line 574, in _threadProc
    xl.keys(), timeout )
  File "/home/abb/pox/pox/openflow/of_01.py", line 506, in fileno
    return self.sock.fileno()
  File "/usr/lib/python2.7/socket.py", line 224, in meth
    return getattr(self._sock,name)(*args)
  File "/usr/lib/python2.7/socket.py", line 170, in _dummy
    raise error(EBADF, 'Bad file descriptor')
error: [Errno 9] Bad file descriptor

If I look at traffic dump, the difference between situation when POX crashes and when it does not crash appears to be TCP RST coming from the client too soon.

10:58:42.256758 IP 127.0.0.1.43080 > 127.0.0.1.6633: Flags [S], seq 1469518076, win 32792, options [mss 16396,sackOK,TS val 5768440 ecr 0,nop,wscale 4], length 0
10:58:42.256790 IP 127.0.0.1.6633 > 127.0.0.1.43080: Flags [S.], seq 1774215631, ack 1469518077, win 32768, options [mss 16396,sackOK,TS val 5768440 ecr 5768440,nop,wscale 4], length 0
10:58:42.256802 IP 127.0.0.1.43080 > 127.0.0.1.6633: Flags [.], ack 1, win 2050, options [nop,nop,TS val 5768440 ecr 5768440], length 0
10:58:42.259454 IP 127.0.0.1.43080 > 127.0.0.1.6633: Flags [P.], seq 1:9, ack 1, win 2050, options [nop,nop,TS val 5768440 ecr 5768440], length 8
10:58:42.259473 IP 127.0.0.1.6633 > 127.0.0.1.43080: Flags [.], ack 9, win 2048, options [nop,nop,TS val 5768440 ecr 5768440], length 0
10:58:42.273724 IP 127.0.0.1.43080 > 127.0.0.1.6633: Flags [F.], seq 9, ack 1, win 2050, options [nop,nop,TS val 5768444 ecr 5768440], length 0
10:58:42.287645 IP 127.0.0.1.6633 > 127.0.0.1.43080: Flags [P.], seq 1:9, ack 10, win 2048, options [nop,nop,TS val 5768447 ecr 5768444], length 8
10:58:42.287690 IP 127.0.0.1.43080 > 127.0.0.1.6633: Flags [R], seq 1469518086, win 0, length 0

**Comment by MurphyMc** [comment]
Thanks for doing some research on this!  I'll look into it.

**Comment by MurphyMc** [comment]
I think this might be the same as the issue discussed in this pull request: https://github.com/noxrepo/pox/pull/20

Do you have an easily reproducible testcase?  Can I get ahold of that?

**Comment by abbbe** [comment]
Sure. I've made fix-ebadfd branch for you, take it from my repo. The failure does not occur every time, but if you run the script in a loop, it does happen eventually:

$ while sleep 1; do python pox.py --no-cli forwarding.l2_learning nm.test ; done
...
POX 0.0.0 / Copyright 2011 James McCauley
test_0031_crash_on_rapid_close (pox.nm.test.TestController)
apparently this test upsets pox by closing connection too fast ... Exception in thread Thread-1:
Traceback (most recent call last):
  File "/usr/lib/python2.7/threading.py", line 551, in __bootstrap_inner
    self.run()
  File "/usr/lib/python2.7/threading.py", line 504, in run
    self.__target(_self.__args, *_self.__kwargs)
  File "/home/abb/dvp/pox/pox/lib/recoco/recoco.py", line 574, in _threadProc
    xl.keys(), timeout )
  File "/home/abb/dvp/pox/pox/openflow/of_01.py", line 506, in fileno
    return self.sock.fileno()
  File "/usr/lib/python2.7/socket.py", line 224, in meth
    return getattr(self._sock,name)(*args)
  File "/usr/lib/python2.7/socket.py", line 170, in _dummy
    raise error(EBADF, 'Bad file descriptor')
error: [Errno 9] Bad file descriptor

The test script pox/nm/test.py invokes my module which configures local OVS switch. For that purpose it spawns external processes, but takes care to close fds in the child, so normally it should not cause problems to POX threads running in parent.

Tell me if you need anything else.

**Comment by MurphyMc** [comment]
Thanks!

If you had the time, you could also try seeing if this patch fixes things or not: https://gist.github.com/2929386

**Comment by abbbe** [comment]
I've run the test in the loop for almost 2.5 hours -- no crashes.

On 06/14/2012 12:40 PM, Murphy wrote:

> Thanks!
> 
> If you had the time, you could also try seeing if this patch fixes things or not: https://gist.github.com/2929386
> 
> ---
> 
> Reply to this email directly or view it on GitHub:
> https://github.com/noxrepo/pox/issues/18#issuecomment-6325081

## 

Alexandre Bezroutchko
Gremwell bvba
+32.479.72.65.27

**Comment by MurphyMc** [comment]
Great; thanks for the feedback.  I'm pushing my patch from Issue #20.  Hopefully that resolves this.
